<?xml version="1.0" encoding="UTF-8"?>
<!--
  -
   - Copyright 2021 Comcast Cable Communications Management, LLC
  -
  - Licensed under the Apache License, Version 2.0 (the "License");
  - you may not use this file except in compliance with the License.
  - You may obtain a copy of the License at
  -
  - http://www.apache.org/licenses/LICENSE-2.0
  -
  - Unless required by applicable law or agreed to in writing, software
  - distributed under the License is distributed on an "AS IS" BASIS,
  - WITHOUT WARRANTIES OR CONDITIONS OF ANY KIND, either express or implied.
  - See the License for the specific language governing permissions and
  - limitations under the License.
  -
  - SPDX-License-Identifier: Apache-2.0
  -
  -->
<DeviceDescriptorList version="7.3.0-020619" xmlns:xsi="http://www.w3.org/2001/XMLSchema-instance" xsi:noNamespaceSchemaLocation="WhiteList.xsd">
    <!-- Converge DDL -->

    <CameraDeviceDescriptor>
        <uuid>4d756c74-694d-6564-6961-7894b4fd1462</uuid>
        <description>Sercomm XCAM2</description>
        <manufacturer>Sercomm</manufacturer>
        <model>SCHC2AWW</model>
        <hardwareVersions><any/></hardwareVersions>
        <firmwareVersions>
            <list>
                <version>3.0.02.54</version>
                <version>3.0.02.20</version>
            </list>
        </firmwareVersions>
        <minSupportedFirmwareVersion>3.0.02.20</minSupportedFirmwareVersion>
        <latestFirmware>
            <version>3.0.02.54</version>
            <filename>SERXW3_2.1p6s1_PRODsd.bin</filename>
        </latestFirmware>
        <protocol>openHome</protocol>
        <motion>
            <enabled>false</enabled>
            <sensitivityLevel>
                <low>70</low>
                <med>80</med>
                <high>90</high>
            </sensitivityLevel>
            <detectionThreshold>
                <low>27</low>
                <med>22</med>
                <high>8</high>
            </detectionThreshold>
            <regionOfInterest>
                <width>16</width>
                <height>16</height>
                <bottomCoord>240</bottomCoord>
                <topCoord>479</topCoord>
                <leftCoord>96</leftCoord>
                <rightCoord>543</rightCoord>
            </regionOfInterest>
        </motion>
    </CameraDeviceDescriptor>

</DeviceDescriptorList>